{
  "client": "BOSSA Asado i Mar",
  "client_type": "restaurant",
  "campaign_name": "Weekend Fire Box",
  "objective": "reservations",
  "audience": "Curaçao residents",
  "message": "Ask about the verified weekend offer",
  "verified_facts": ["Draft copy only"],
  "source_links": ["https://example.com/approved-brief"],
  "evidence_status": "Owner-provided",
  "language": "EN",
  "channel": ["WhatsApp"],
  "format": "9:16",
  "duration_seconds": 30,
  "identity_authorized": false,
  "cta": "Request details",
  "destination_url": "https://example.com/contact",
  "approval_owner": "Owner",
  "owner_gate_id": "OWNER-GATE-VIDEO-DRAFT-01",
  "authorized_stage": "Draft",
  "authorized_actions": ["Draft script", "Draft shot list"],
  "prohibited_actions": ["Produce", "Schedule", "Publish"],
  "approval_records": [],
  "status": "Script Draft",
  "due_date": null,
  "publish_date": null
}
